[
  {
    "id": "hr-zg-1",
    "country": "Croatia",
    "city": "Zagreb",
    "name": "Bundek Dog Zone",
    "latitude": 45.7923,
    "longitude": 15.9816,
    "fenced": true,
    "water": true,
    "shade": true,
    "surface": "grass",
    "risk_notes": "Gets crowded on Sundays",
    "tips": "Best in the evening",
    "rating": 4.8,
    "reviews_count": 32,
    "evidence_status": "demo_unverified",
    "evidence_ref": null
  },
  {
    "id": "hr-st-1",
    "country": "Croatia",
    "city": "Split",
    "name": "Žnjan Dog Area",
    "latitude": 43.509,
    "longitude": 16.462,
    "fenced": false,
    "water": true,
    "shade": false,
    "surface": "beach",
    "risk_notes": "Strong sun in summer",
    "tips": "Go early morning",
    "rating": 4.4,
    "reviews_count": 18,
    "evidence_status": "demo_unverified",
    "evidence_ref": null
  },
  {
    "id": "si-lj-1",
    "country": "Slovenia",
    "city": "Ljubljana",
    "name": "Tivoli Dog Area",
    "latitude": 46.056,
    "longitude": 14.487,
    "fenced": true,
    "water": false,
    "shade": true,
    "surface": "forest soil",
    "risk_notes": "Parking pressure weekends",
    "tips": "Morning walks best",
    "rating": 4.7,
    "reviews_count": 24,
    "evidence_status": "demo_unverified",
    "evidence_ref": null
  },
  {
    "id": "at-w-1",
    "country": "Austria",
    "city": "Vienna",
    "name": "Donauinsel Hundezone",
    "latitude": 48.2404,
    "longitude": 16.4136,
    "fenced": false,
    "water": true,
    "shade": true,
    "surface": "grass & river bank",
    "risk_notes": "Crowded peak hours",
    "tips": "Best outside weekends",
    "rating": 4.9,
    "reviews_count": 40,
    "evidence_status": "demo_unverified",
    "evidence_ref": null
  }
]
